<?xml version="1.0" encoding="utf-8"?>
<xs:schema targetNamespace="DS_DELMIAMGAConfiguration" xmlns:tns="DS_DELMIAMGAConfiguration" xmlns:xs="http://www.w3.org/2001/XMLSchema" elementFormDefault="qualified" attributeFormDefault="unqualified">
  <xs:element name="Config">
    <xs:complexType>
      <xs:sequence>
        <xs:element name="Label">
          <xs:complexType>
            <xs:simpleContent>
              <xs:extension base="xs:string">
                <xs:attribute type="xs:string" name="dataIndex"/>
                <xs:attribute type="xs:string" name="dicoType"/>
              </xs:extension>
            </xs:simpleContent>
          </xs:complexType>
        </xs:element>
        <xs:element name="Columns">
          <xs:complexType>
            <xs:sequence>
              <xs:element name="Column" maxOccurs="unbounded" minOccurs="0">
                <xs:complexType>
                  <xs:simpleContent>
                    <xs:extension base="xs:string">
                      <xs:attribute type="xs:string" name="dataIndex" use="optional"/>
                      <xs:attribute type="xs:string" name="dicoType" use="optional"/>
                      <xs:attribute type="xs:string" name="displayType" use="optional"/>
                      <xs:attribute type="xs:boolean" name="mandatory" use="optional"/>
                      <xs:attribute type="xs:string" name="Tooltip" use="optional"/>
                    </xs:extension>
                  </xs:simpleContent>
                </xs:complexType>
              </xs:element>
            </xs:sequence>
          </xs:complexType>
        </xs:element>
      </xs:sequence>
      <xs:attribute type="xs:string" name="name"/>
    </xs:complexType>
  </xs:element>
</xs:schema>
