<?xml version="1.0" encoding="UTF-8"?>
<!-- Copyright DASSAULT SYSTEMES 2013 -->
<Config name="Manufacturing" xmlns="DS_DELMIAMGAConfiguration" xmlns:xsi="http://www.w3.org/2001/XMLSchema-instance" xsi:schemaLocation="DS_DELMIAMGAConfiguration ../xsd/ColumnConfig.xsd" Title="UI Config" Description="Sample configuration file delivered by DS.">
    <Label dataIndex="V_Name.reference" dicoType="PLMEntity"/>
    <Columns>
        <Column dataIndex="revision.reference" dicoType="BusinessType"/>
        <Column dataIndex="V_description.reference" dicoType="PLMEntity" Tooltip="NameRevisionOwner.tooltip"/>
		    <Column dataIndex="V_ApplicabilityDate.reference" dicoType="PLMCoreReference"/>
        <Column dataIndex="ManufacturingItemUpdateStatus" displayType="BIEssentials"/>
        <Column dataIndex="current.reference" dicoType="BusinessType"/>
        <Column dataIndex="owner.reference" dicoType="BusinessType"/>
        <Column dataIndex="organization.reference" dicoType="BusinessType"/>
        <Column dataIndex="Scope.relation" displayType="Relation"/>
        <Column dataIndex="Implement.relation" displayType="Relation"/>
        <Column dataIndex="All.relation" displayType="Relation"/>
        <Column dataIndex="documents.document" displayType="DocMgmt"/>
        <Column dataIndex="V_isLastVersion.reference" dicoType="PLMCoreReference" displayType="NonEditable"/>
    </Columns>
</Config>
