<?xml version="1.0" encoding="UTF-8"?>
<!-- Copyright DASSAULT SYSTEMES 2013 -->
<Config name="ProductsAndParts" xmlns="DS_DELMIAMGAConfiguration" xmlns:xsi="http://www.w3.org/2001/XMLSchema-instance" xsi:schemaLocation="DS_DELMIAMGAConfiguration ../xsd/ColumnConfig.xsd" Title="UI Config" Description="Sample configuration file delivered by DS.">
    <Label		dataIndex="V_Name.reference"		dicoType="PLMEntity"		displayType="NonEditable"/>
    <Columns>
        <Column	dataIndex="PLM_ExternalID.instance"		    dicoType="PLMInstance"		    displayType="NonEditable"/>
        <Column	dataIndex="revision.reference"		        dicoType="BusinessType"		    displayType="NonEditable"/>
        <Column dataIndex="ProductAssignmentStatus"       displayType="BIEssentials"/>
        <Column	dataIndex="V_description.reference"	      dicoType="PLMEntity"		      displayType="NonEditable" Tooltip="NameRevisionOwner.tooltip"/>
        <Column	dataIndex="owner.reference"			          dicoType="BusinessType"		    displayType="NonEditable"/>
        <Column	dataIndex="PLM_ExternalID.reference"			dicoType="PLMEntity"		      displayType="NonEditable"/>
        <Column	dataIndex="V_isLastVersion.reference"			dicoType="PLMCoreReference"		displayType="NonEditable"/>
        <Column	dataIndex="current.reference"		          dicoType="BusinessType"		    displayType="NonEditable"/>
    </Columns>
</Config>
