<?xml version="1.0" encoding="UTF-8"?>
<!-- Copyright DASSAULT SYSTEMES 2013 -->
<Config name="Routings" xmlns="DS_DELMIAMGAConfiguration" xmlns:xsi="http://www.w3.org/2001/XMLSchema-instance" xsi:schemaLocation="DS_DELMIAMGAConfiguration ../xsd/ColumnConfig.xsd" Title="UI Config" Description="Sample configuration file delivered by DS.">
      <Label dataIndex="V_Name.reference" dicoType="PLMEntity"/>
      <Columns>
        <!-- <Column dataIndex="originated.reference"          displayType="DateTime" dicoType="BusinessType"/> -->
        <!-- <Column dataIndex="V_ApplicabilityDate.reference" displayType="DateTime" dicoType="DELLmiProductionSystemReference"/> -->
        <Column dataIndex="V_Balanceable.instance"             dicoType="DELLmiOperationPPRInstance"/>
        <!-- <Column dataIndex="V_QueuingModeIN.reference"     dicoType="DELLmiProductionSystemReference"/> -->
        <Column dataIndex="documents.document"                 displayType="DocMgmt"    minWidth="50"/>
        <Column dataIndex="current.reference"                  dicoType="BusinessType"  minWidth="50"/>
        <Column dataIndex="Routings_Items.relation"            displayType="Relation"   minWidth="50"/>
        <Column dataIndex="Routings_Resources.relation"        displayType="Relation"   minWidth="50"/>
      </Columns>
</Config>
