<?xml version="1.0" encoding="UTF-8"?>
<!-- Copyright DASSAULT SYSTEMES 2013 -->
<Config name="Manufacturing" xmlns="DS_DELMIAMGAConfiguration" xmlns:xsi="http://www.w3.org/2001/XMLSchema-instance" xsi:schemaLocation="DS_DELMIAMGAConfiguration ../xsd/ColumnConfig.xsd" Title="UI Config" Description="Sample configuration file delivered by DS.">
    <Label dataIndex="V_Name.reference" dicoType="PLMEntity"/>
    <Columns>
        <Column dataIndex="V_Name.reference" displayType="PLMEntity"/>
        <Column dataIndex="V_description.reference" displayType="PLMEntity"/>
        <Column dataIndex="revision.reference" displayType="BusinessType"/>
        <Column dataIndex="owner.reference.relation" displayType="BusinessType"/>
        <Column dataIndex="Items_Routings.relation" displayType="Relation"/>
    </Columns>
</Config>
